{
  "$schema": "https://json-schema.org/draft/2020-12/schema",
  "title": "Research Writing Delegate Revision Brief",
  "type": "object",
  "additionalProperties": true,
  "required": ["task", "feedback"],
  "properties": {
    "task": {
      "type": "object",
      "additionalProperties": true,
      "required": ["type", "target", "goal"],
      "properties": {
        "type": {
          "type": "string",
          "enum": [
            "draft_paragraph",
            "rewrite",
            "tighten",
            "bridge",
            "abstract",
            "critique",
            "related_work",
            "theory",
            "literature_review",
            "limits"
          ]
        },
        "target": {
          "type": "string",
          "minLength": 1
        },
        "goal": {
          "type": "string",
          "minLength": 1
        },
        "length": {
          "type": "string"
        }
      }
    },
    "context": {
      "type": "object",
      "additionalProperties": true
    },
    "claims": {
      "type": "object",
      "additionalProperties": true
    },
    "sources": {
      "type": "array",
      "items": {
        "type": "object"
      }
    },
    "style": {
      "type": "object",
      "additionalProperties": true
    },
    "feedback": {
      "type": "object",
      "additionalProperties": true,
      "required": [
        "previous_draft",
        "codex_review",
        "requested_changes",
        "user_approved"
      ],
      "properties": {
        "previous_draft": {
          "type": "string",
          "minLength": 1
        },
        "codex_review": {
          "type": "object",
          "additionalProperties": true,
          "required": ["recommendation"],
          "properties": {
            "recommendation": {
              "type": "string",
              "enum": ["accept_with_edits", "regenerate", "manual_edit", "discard"]
            },
            "claim_fit": {
              "type": "array",
              "items": {
                "type": "string"
              }
            },
            "citation_risk": {
              "type": "array",
              "items": {
                "type": "string"
              }
            },
            "style_fit": {
              "type": "array",
              "items": {
                "type": "string"
              }
            }
          }
        },
        "requested_changes": {
          "type": "array",
          "minItems": 1,
          "items": {
            "type": "string",
            "minLength": 1
          }
        },
        "user_approved": {
          "const": true
        }
      }
    }
  }
}
